{
  "schema_version": 1,
  "scene_id": "industrial_frontier:batch_processing_basics",
  "target_item": "create:basin",
  "script": "kubejs/client_scripts/10_ponder/01_batch_processing.js",
  "learning_objectives": [
    "Distinguish input and output buffers.",
    "Treat a machine as one stage in a material flow.",
    "Recognise blocked output as a line-wide bottleneck.",
    "Separate batch size from continuous throughput."
  ],
  "test_gate": [
    "Scene is available from the Create basin.",
    "All placed blocks render.",
    "Russian text is readable and points to the intended block.",
    "No PonderJS error is emitted to latest.log."
  ]
}
